SN,Title,Company,Experience,Salary,Description
0,Opening for Account Executive,Karishma Marine Solutions Private Limited,1-4 years,360000 - 400000 INR,"Requirements: 	Minimum 2  4 years of experience as an Accounts Assistant. 	Knowledge of working on Tally. 	Good command over Microsoft Excel with running all Formulas, Pivots, Macros, etc, 	MS Word, PowerPoint, Outlook, with a tendency to learn new software, 	Must know Tally Software"
1,Architect Interior Designer Furniture Designer,I2canz Outsourcing Private Limited,2-10 years,2550000 - 3550000 INR,"Architect Architectural standards specialist Chief architect Consulting architect The industrial and commercial building's architectResidential architect Main duties This group performs some or all of the following duties: Consult with clients to determine the type, style and purpose of renovations or new building construction being considered Conceptualize and design buildings and develop plans describing design specifications, building materials, costs and construction schedules Prepare sketches and models for clients Prepare or supervise the preparation of drawings, specifications and other construction documents for use by contractors and tradespersons Prepare bidding documents, participate in contract negotiations and award construction contracts Monitor activities on construction sites to ensure compliance with specifications Conduct feasibility studies and financial analyses of building projects. Architects may specialize in a particular type of construction such as residential, commercial, industrial or institutional."
2,Video Editor,Sakhsham Knowledge Services Private Limited,1-3 years,200000 - 350000 INR,"About the Client:Our client is a leading global multimedia software vendor platform with 20+ years and millions of users under its belt already. Their software is a leading name in its category across both android and iOS platforms. They are one of the most well-known and respected industry names and the work we do is fueling their growth plan.Key Responsibility Areas (KRAs):Be able to work with a wide range of input media including stocks, sounds, images, etc.Deliver creativity while being focused on quality and deliverables.Extrapolate feedback received from the client for one assignment onto other assignments.Be able to think for and cater to an international audienceBe able to work, contribute, and grow in a team environmentRequirements:A bachelor's degree or equivalent with specialist skills in video editing is required.Well-versed in all aspects of video editing such as stocks, sounds, layers, graphics, animations, etc.Editing software experience, such as Adobe After Effects, Final Cut Pro X, Avid Media Composer, Lightworks, and Premier.Candidates with additional skillsets such as motion graphics, graphic design, and copywriting, will be preferred.Candidates with significant provable experience in creating ad films, animations, and digital promo films will be preferred.Basics:5 vacancies are open for hire. Immediate joining.Remuneration: Inline with industry standards, qualifications and experienceLocation: Work From Office onlyExpectation: 2+ years commitment to the role to make the engagement meaningfulThis would be a full-time position with an exclusive engagementProbation: First 3 months, followed by performance-based confirmation"
3,UI Designer,Silverlink Technologies Private Limited,8-12 years,Not Specified,"Hi , This is Selciya from Silverlink Technologies. We have an excellent job opportunity with TCS for the post UI Designer at Pune,Mumbai,Delhi,Bangalore  Location If interested kindly forward me your word formatted updated profile ASAP on [Confidential Information] Please Fill the mandatory details Full Name: Pan Card No: Mail Id: Date of Birth: Role : UI Designer1.	Knowledge of UCD principles  2.	Adobe XD, Sketch, Figma, & Adobe Creative Suite 3.	Knowledge of design software's including Adobe suite & others 4.	Ability to visualize the objects of a project and determine the steps and processes to bring them to life Exp: 6+ Years Mode: Permanent Location: Pune,Mumbai,Delhi,BangaloreInterview Mode: Any"
4,ugent opening for AWS,T & M Services Consulting Private Limited,8-10 years,Not Specified,"As discussed, ITC InfoTech is hiring for position of AWS for full time for Bangalore location.Experience in Cloud Service/Serverless AWS  Lambdas, Step Functions, ECS,EC2, S3, Fargate, CloudFormation, CloudWatch, API Gateway, Dynamo DB, Elastic Search, SQS/SNS, Microservices, Circuit Breakers,Experience : 8 10 yearsWork Location : BangaloreBudget : max 20-30 LPANotice Period : Immediate to 15 daysAre you interested If yes!Please find the below Job DescriptionRole & Responsibilities: 1.	Producing solution designs and implementing plans for cloud-based AWS and on-premise API management solutions and infrastructure; incorporating innovative solutions into designs.2.	Collaborating with cross-team members of the technology organization to develop API's (I.e. REST, SOAP) to expose metadata to end-users.3.	Lead the team to mature internal API development and management best practices working in conjunction with Strategy & Architecture.4.	Manage full-cycle web application development using Agile approach with feedback cycle of design, develop, present, feedback and iterate.5.	Establish monitoring key metrics necessary to understand and maintain performance of overall API traffic i.e. volume, availability, throughput and health.6.	Participate in Performance testing to make API more efficient.7.	Discover and capitalize on automation opportunities that provide business value.8.	DocumentationKey Skill Sets	Experience in Cloud Service/Serverless AWS  Lambdas, Step Functions, ECS,EC2, S3, Fargate, CloudFormation, CloudWatch, API Gateway, Dynamo DB, Elastic Search, SQS/SNS, Microservices, Circuit Breakers,	Node.js, Java	Springboot framework	Database Concepts KnowledgeDynamoDB, MongoDB, Oracle. (NoSQL)	Vue.js / React.js for UI development 	Knowledge on API Tools preferable: Apigee	Knowledge of DevOps tools & GitHub	Understand API interface tools  Swagger, Postman	Data Consuming Technology: REST, SOAP	Unit Testing in JEST framework. Helping in automation of test cases.	Observability, Knowledge of logging mechanisms  Splunk	Worked in Agile tools like Version One, JIRAEngineering Principals	Resource should be able to adopt following principals in his role.o	Everything as Code (Automated Test Case, Deployment)o	New Development is Cloud Native and Scalableo	One team owns a solution End to End,o	Frequent Demos and Continuous user feedback o	Observability everywhere o	Documentation o	Security is built in at the starto	API Driven for all solutionsCertifications- 	AWS Certified Developer- associate, 	AWS certified solution architect"
5,Graphic Designer - Australia,A V Immigration And Careers Consultancy Private Limited,5-10 years,Not Specified,"Tasks determining the objectives and constraints of the design brief by consulting with clients and stakeholders.undertaking research and analysing functional communication requirements.formulating design concepts for the subject to be communicatedpreparing sketches, diagrams, illustrations and layouts to communicate design concepts.negotiating design solutions with clients, management, sales and production staff.selecting, specifying or recommending functional and aesthetic materials and media for publication, delivery or display.detailing and documenting the selected design for production.supervising or carrying out production in the chosen mediamay archive information for future client use."
6,Video Editor,Navis Human Resources Private Limited,2-7 years,320000 - 660000 INR,"Assembling raw footage and transferring or uploading to a computer Following a script, screenplay or outline Inputting sound to enhance footage, which may include selecting music and writing voice-overs Inputting graphics to enhance footage Digitally splicing film and video and synchronizing them into one rough cut file Improving and correcting lighting, coloring and faulty footage Working closely with directors to present a final product that matches his or her vision"
7,Software Test Engineer  - BE Mechanical / Civil / ECE / EEE Commerce,Fazo Software,Fresher,270000 - 900000 INR,"Greetings Dear job Seekers.- Great opportunityfor BE -Mechanical / Civil / ECE / EEE & Commerce - No problem if your from any year passed out.Requirements :-Should be good in communication at leastdecent level.Average to Strong Knowledge in software ( Java / .NET & Software Testing )If your from any year passed out no problem.Salary post selection will be 18000 - 27000 per month.Location : Chennai & Bangalore.If weak in technical, candidates will be having training.Regards. HR Team. TamilSelvi - 6374808456 Vinothini - 8072712418  (WhatsApp your resume )"
8,Data Entry Operator l Back Office l Work From Home Jobs,Apex Trading & Softech Solutions,0-5 years,110000 - 240000 INR,"1) Typing speed and accuracy should be maintained. 2) Candidate has to maintain Company Data Base in software. 3) Typing speed should be minimum 20 WPM to 25 WPM. 4) Should have own PC/Laptop at Home. 5) Should be available to work from Home for company. 6) Flexible towards the working environment. Requirement For Candidate's profile: 1) Any Degree / Diploma / 10th / 12th Pass out. 2) Basic Typing Knowledge must be required. 3) Anyone can work as Part Time or Full Time. 4) Experience, Fresher both can apply. 5) Flexible Shift and all facility available. 6) Retired, Housewife, Student are Welcome. 7) Shift Timing: Can work anytime in a day. Note: Candidate should have Enough Time (6 to 7 hrs.) to work."
9,Computer Operator | Data Entry Operator l Work From Home Jobs,Apex Trading & Softech Solutions,0-5 years,110000 - 240000 INR,"1) Typing speed and accuracy should be maintained. 2) Candidate has to maintain Company Data Base in software.3) Typing speed should be minimum 20 WPM to 25 WPM. 4) Should have own PC/Laptop at Home.5) Should be available to work from Home For company. 6) Flexible towards the working environment. Requirement For Candidate's profile: 1) Any Degree / Diploma / 10th / 12th Pass out. 2) Basic Typing Knowledge must be required. 3) Anyone can work as Part Time Or Full Time. 4) Experience, Fresher both can apply. 5) Flexible Shift and all facility available. 6) Retired, Housewife, Student are Welcome. 7) Shift Timing: Can work anytime in a day. Note : Candidate Should have Enough Time ( 6 to 7 hrs. ) to work. For More Details Contact / Whats app @ 9903990528"
10,Bussiness Analyst,Eminence Tech System Private Limited,3-5 years,Not Specified,"The Robotics Process Automation Business Analyst helps define the business case for the  proposed automation of the business processes by reviewing the current process, identifying  the automation potential of the process, and the potential FTE takeout. The process architect  working with the customer subject matter experts, and the technical architect designs the  steps in the process that can be automated (with or without reengineering), and which serves  as a basis for the development team to implement the robotics. The business analyst will also review the design at the design stage, validates the developed  automation to ensure it meets the intended design and the business benefitsDUTIES / ACCOUNTABILITIES Responsibilities include, but may not be restricted to:Analyze an organization and understand its processes and systems, to define the  current state of the process (as is process map) and documenting relevant  information needed to determine automation potential. The examples are as below : o Process steps, number of applications involved, and process steps per application o Process volumes, including any seasonal variations. o FTE needed to execute the process o Average handling time o Process interdependencies o Target SLA , Financial or regulatory points associated with the process. o Process error rate, error volumes, and exception handling steps o % of process steps including paper, voice, digital etc.  Define the future state and/or business solution to automate the defined processes  by designing the to-be process maps that includes some of the following  information: o Identifying & documenting clearly  The steps in the process suited for automation  The source systems, work queues, the flow of the steps, the decision points, the  exception paths, and the business rules  Outputs and exceptional handling scenarios  Scenarios and test data o Reduction in Average handling, and FTE takeout as a result of automation o Recommendations to alter or reengineer process to improve automation potential o Processes that are not suitable, or would not lend any return on investment  Ensures the designs are documented within the defined project timelines, and with  quality.  Performs Quality Control via reviews of the design created by other business analysts.Responsible for receiving the sign-off on the design from the customer, and place  the design under configuration control.  Serves as the functional expert for the development and test teams.  Resolve queries/issues from the development and test teams.  Validate implemented robotics to ensure that it meets the goals and objectives as  defined in the design."
11,Multimedia Designer - Australia/Canada,A V Immigration And Careers Consultancy Private Limited,5-10 years,Not Specified,"task includes design graphics and animations for websites, trade shows and marketing promotions. recommend design techniques to improve look and feel of the graphics. modify and improvise graphics to optimize load time, structure and layout. identify and troubleshoot design related problems in a timely fashion. edit video and audio to support multimedia programs. conduct quality checks before submitting any work or project. coordinate with other staffs to deliver high quality product. stay updated on latest industry trends on graphic design and development techniques. evaluate design concepts and recommend improvements. perform graphic designs using corporate standard software."
12,Fresher Android Apps Developer Android Mobile App Programming Freshers Jobs,DRPU Software Pvt. Ltd.,0-2 years,220000 - 660000 INR,"Great Opportunity for Fresher Android Developers looking for Company Jobs. Currently we are looking for Freshers for Development on Android Studio SDK Android Mobile Apps Programming. Candidates will be responsible for Android Phone application Developer Profile and other related Mobile application development. Mobile Phone Apps Programmers interested in working on JAVA Programming for Google Play Store mobile Apps development should opt for this opportunity.we are looking for Android Developers Android Studio SDK Android Programmers for Mobile Phone Apps Programming.Candidates should be capable to Design and build applications for the Android platform. Candidates should be capable for independent development, developing Android applications for mobile / tablet devices."
13,Adobe Photoshop Graphic Designer Graphics Designing Jobs for Freshers,DRPU Software Pvt. Ltd.,0-1 years,260000 - 670000 INR,"Fresher Graphic Designer Adobe Photoshop Graphics Designing Freshers Job Delhi NCRWe are also Hiring Freshers for this Profile! DRPU Software Pvt. Ltd. is looking for creative graphic designers having good knowledge of adobe Photoshop. Candidate responsibilities may include:Designing Graphics for Websites and web portalsDesigning Apps GUI and icons etcDesigning Banners Promos and Ads etc for Social Media, Print Media and website.- Proficient in Computer Graphic Software like : Adobe Photoshop, Adobe Illustrator, Adobe InDesign- Immediate Joiners will be preferred.Job Responsibilities :  Creative Logos Banners for Websites & Social Medias Flex Banners Flyer Design Brochure & Pamphlet DesignCreate Stylish and suitable images according to the instructions GivenShould have a strong sense of design, color, and proportioning, these creative individuals design backgrounds for characters and objects to live in and move through in a natural mannerGood Coloring Knowledge and very good understanding of Color theory and usage of colors.Key Skills:Good Artistic SkillsAdobe IllustratorAdobe PhotoshopProficient in Photoshop, Adobe Illustrator and Corel Draw. Expert in editing photos using PhotoshopWe are Looking for creative Graphic Designers having good knowledge of Adobe Photoshop Designing for Websites & web portals, Designing Apps GUI & icons etc, Designing Banners Promos & Ads etc for Social Media, Print Media & website.Generate designs for new original content, promotions, and support for web, mobile, and print including corporate website, landing pages, blogs, emails, collateral, white papers, infographics, advertisements, signage, and more.Concept and design charts, graphs and other visuals and design and produce executive-level PowerPoint presentations.Creative visual designs for a business audience. Take a complicated concept and create a simple, easy to understand and compelling graphic, illustration or infographic.Ability to provide creative direction for videos and photography.Support Popular Domains event strategy with tradeshow booth design, speaker presentations, print and digital signage, handouts, and poster, collateral.Develop and expand the brand awareness of Popular Domains through visual designs and experiences that excite and engage customers, while influencing their attitudes and beliefs regarding our technology.Establish and maintain consistency of design and a high level of quality across all company mediums.Stay on the cutting edge of design trends, tools, and best practices.Excellent digital and graphic designs skills with a strong eye for design trends, the digital design language, photography, typography and overall visual storytelling. Create design solutions in a wide range of graphic applications for collateral materials, infographics, publications, digital slides, event graphics, ads, direct mailers, etc."
14,Vector Illustrator Animator,Raj & Sam Marketing LLP,1-3 years,300000 - 450000 INR,"R&SM is hiring for a vector illustrator animator Here's the job description- The ideal candidate will create animated videos with illustrations - The exact examples are attached(with a Youtube link). As shown in the sample project video, the style of the video is realistic (more sciencey and human body related - These are animated vector illustrations).The candidate will be responsible for brainstorming, creating, and designing short illustration videos from scratch. New multiple projects would be provided on daily basis. The candidate would brainstorm unique ideas with one of our marketers and is free to provide his or her creative ideas regarding the project as well. On some of the working days, the candidate would be free to create his/her own projects using their own creativity & experience.We prioritize creativity and hard work over everything. The candidate must be highly skillful and complete the project within the timeframe provided. The candidate must be fairly proficient (not expert) in English as majorly all projects and their details will be conducted in that language.Find the sample of work attached in a youtube video link. https://youtu.be/I3wN3oGkWg0 As shown in the sample project video, the style of the video is realistic (more sciencey and human body related - These are animated vector illustrations)"
15,Software Test Engineer,Fazo Software,Fresher,Not Specified,"Software Test Engineer - 2010 to 2019 passed out freshers.Location: ChennaiVacancy: 9 Position.Experience: Freshers only.Description:-Working on an eCommerce website.Mobile application Testing & Web Application Testing.Strong Knowledge in writingtest cases.Finding bugs, smoke testing.certification is mandatory if not will be trained.immediate joining.Regards. HR Team. Tamil Selvi - 6374808456 Vinothini - 8072712418  (WhatsApp your resume )"
16,Business Development Executive,Techfruits Solutions Private Limited,0-5 years,330000 - 660000 INR,"We represent the best Hardware & Software companies like Dell - EMC, HP, HPE, PureStorage, IBM, F5, SpectraLogic, Adobe, Commvault, AWS, Microsoft and Many moreTitle / Designation : Business Development ExecutiveLocation : Thiruvananthapuram, KeralaSalary: Open for perfect match candidateCandidate Should have Following skills Oversee the sales process to attract new clients and cold calling  Work with senior team members to identify and manage sales opportunities.  Maintain fruitful relationships with clients and address their needs effectively.  Research and identify new market opportunities. Excellent leadership and communication skills."
17,Freshers B.E BTech BCA MCA MCA Fresher Jobs in Ghaziabad Delhi NCR near Meerut Hapur Noida Modinagar,DRPU Software Pvt. Ltd.,0-1 years,150000 - 660000 INR,"We have multiple Job openings for Freshers for Different profiles. We are looking for Fresher and entry level B.E, B.Tech, BCA MCA & Diploma Fresher / Trainee Software Engineers for Multiple Profiles such as Testing Website Content writing Software Documentation SEO and Website Promotion and many more.Freshers B.E BTech BCA MCA MCA Jobs in Ghaziabad Delhi NCR near Meerut Hapur Noida ModinagarDifferent Job Profiles may include Candidate responsibilities as follows:Software TestingSoftware Help DocumentationWebsite Content writingApps Data compile and procedure designWeb Authoring and Instruction GuidesTechnical WritingSEO and Website PromotionNetworkingComputers & Network Maintenance Content writing"
18,"Urgently Hiring l Data Entry, Work from home  Jobs l Computer Entry Jobs I Opportunity for freshers",Continuum Edtech,0-5 years,120000 - 340000 INR,Details: It is a home-based freelance data entry work.  Laptop/Desktop & Smartphone are required.  Training will be provided by our team  No Target work. Desired skills and qualities:  Fresher and experience both can apply.   Basic Computer Knowledge.  Should able to maintain good typing speed and accuracy level.  Sound knowledge of English language.  Able to data entry using spreadsheet and other computer software.  Attention to detail.  12th pass or any Graduate can apply.Interested candidate send their CV on our official mail ID.If your CV is selected then we will contact you for online interview. There may be Two rounds of Interview.
19,Urgent vacancy for Data Entry Executive I Opportunity for freshers l Work from home,Continuum Edtech,0-5 years,150000 - 350000 INR,Details: It is a home-based freelance data entry work.  Laptop/Desktop & Smartphone are required.  Training will be provided by our team  No Target work. Desired skills and qualities:  Fresher and experience both can apply.   Basic Computer Knowledge.  Should able to maintain good typing speed and accuracy level.  Sound knowledge of English language.  Able to data entry using spreadsheet and other computer software.  Attention to detail.  12th pass or any Graduate can apply.Interested candidate send their CV on our official mail IDIf your CV is selected then we will contact you for online interview. There may be Two rounds of Interview.
20,Data Entry Jobs l Computer Entry Jobs I Opportunity for freshers l Work from home,Continuum Edtech,0-5 years,150000 - 350000 INR,Details: It is a home-based freelance data entry work.  Laptop/Desktop & Smartphone are required.  Training will be provided by our team  No Target work. Desired skills and qualities:  Fresher and experience both can apply.   Basic Computer Knowledge.  Should able to maintain good typing speed and accuracy level.  Sound knowledge of English language.  Able to data entry using spreadsheet and other computer software.  Attention to detail.  12th pass or any Graduate can apply.Interested candidate send their CV on our official mail ID.If your CV is selected then we will contact you for online interview. There may be Two rounds of Interview.
21,Data Entry Jobs l Urgent vacancy I Opportunity for freshers l Work from home,Continuum Edtech,0-5 years,120000 - 360000 INR,Details: It is a home-based freelance data entry work.  Laptop/Desktop & Smartphone are required.  Training will be provided by our team  No Target work. Desired skills and qualities:  Fresher and experience both can apply.   Basic Computer Knowledge.  Should able to maintain good typing speed and accuracy level.  Sound knowledge of English language.  Able to data entry using spreadsheet and other computer software.  Attention to detail.  12th pass or any Graduate can apply.Interested candidate send their CV on our official mail IDIf your CV is selected then we will contact you for online interview. There may be Two rounds of Interview.
22,Data entry Executive l Work from Home l Opportunity for fresher l Home Based work **,Continuum Edtech,0-5 years,130000 - 350000 INR,Details: It is a home-based freelance data entry work.  Laptop/Desktop & Smartphone are required.  Training will be provided by our team  No Target work. Desired skills and qualities: Fresher and experience both can apply.12th pass or any Graduate can apply. Basic Computer Knowledge.Should have good typing speed.Should be able to maintain a fair accuracy level.Sound knowledge of English language.Able to data entry using spreadsheet and other computer software.Attention to detail.Interested candidate send their CV on our official mail ID.If your CV is selected then we will contact you for online interview. There may be Two rounds of Interview.
