SN,Title,Company,Experience,Salary,Description
75,"Hiring For Online Data Entry Jobs, Work From Home jobs, Part Time Jobs, Data Entry Jobs, Typing Jobs",Company Name Confidential,0-5 years,Not Specified,"WE ARE PROVIDING: Data Entry Jobs,Work From Home Jobs,Part Time Jobs,Online Data Entry Jobs,Typing Jobs,Work At Home Jobs,Based Data Entry,Back Office,Non Voice,Freelance,Simple Typing ****************************************************************************************************************************************************** For more details contact us on our Whatsapp number: 7899580103 ****************************************************************************************************************************************************** NATURE OF JOB: work from home jobs,online data entry Jobs,Home based Data entry and proof reading,Part Time Full Time Jobs ****************************************************************************************************************************************************** JOB LOCALITY: All India-any location-work from home *****Skills: Basic Computer Knowledge and Basic Typing skills*********  ****************************************************************************************************************************************************** JOB RESPONSIBILITY: Your Job Responsibilities is that you have to submit your work on time without mistake Company will give you the content you have to just type according to the company guidelines.****EXPERIENCE: Minimum Experience:0 years Maximum Experience: up to 5 years.****REQUIREMENTS: Laptop/Computer/Smart phone****JOB FEATURES: 1.No hard target you can do minimum 30 pages in 7 days 2.No internet required to do the work 3.You can work from any location 4.Hassle free payment guarantee 5.100% payment guaranteed 6.Its very useful for students, retired person housewife & job seekers 7.You can work from home.  ****************************************************************************************************************************************************** Regards, Gautam, Whatsapp number: 7899580103 Thank You"
76,"Part Time Jobs, Data Entry, Work From Home, Data Entry Jobs, Online Data Entry, Home Based Jobs",Company Name Confidential,0-5 years,Not Specified,"WE ARE PROVIDING: Data Entry Jobs,Work From Home Jobs,Part Time Jobs,Online Data Entry Jobs,Typing Jobs,Work At Home Jobs,Based Data Entry,Back Office,Non Voice,Freelance,Simple Typing ****************************************************************************************************************************************************** For more details contact us on our Whatsapp number: 7899580103 ****************************************************************************************************************************************************** NATURE OF JOB: work from home jobs,online data entry Jobs,Home based Data entry and proof reading,Part Time Full Time Jobs ****************************************************************************************************************************************************** JOB LOCALITY: All India-any location-work from home *****Skills: Basic Computer Knowledge and Basic Typing skills*********  ****************************************************************************************************************************************************** JOB RESPONSIBILITY: Your Job Responsibilities is that you have to submit your work on time without mistake Company will give you the content you have to just type according to the company guidelines.****EXPERIENCE: Minimum Experience:0 years Maximum Experience: up to 5 years.****REQUIREMENTS: Laptop/Computer/Smart phone****JOB FEATURES: 1.No hard target you can do minimum 30 pages in 7 days 2.No internet required to do the work 3.You can work from any location 4.Hassle free payment guarantee 5.100% payment guaranteed 6.Its very useful for students, retired person housewife & job seekers 7.You can work from home.  ****************************************************************************************************************************************************** Regards, Gautam, Whatsapp number: 7899580103 Thank You"
77,"Data Entry Jobs, Online Data Entry Jobs available, Typing Jobs, Work From Home Jobs, Part Time Jobs",Company Name Confidential,0-5 years,Not Specified,"WE ARE PROVIDING: Data Entry Jobs,Work From Home Jobs,Part Time Jobs,Online Data Entry Jobs,Typing Jobs,Work At Home Jobs,Based Data Entry,Back Office,Non Voice,Freelance,Simple Typing ****************************************************************************************************************************************************** For more details contact us on our Whatsapp number: 7899580103 ****************************************************************************************************************************************************** NATURE OF JOB: work from home jobs,online data entry Jobs,Home based Data entry and proof reading,Part Time Full Time Jobs ****************************************************************************************************************************************************** JOB LOCALITY: All India-any location-work from home *****Skills: Basic Computer Knowledge and Basic Typing skills*********  ****************************************************************************************************************************************************** JOB RESPONSIBILITY: Your Job Responsibilities is that you have to submit your work on time without mistake Company will give you the content you have to just type according to the company guidelines.****EXPERIENCE: Minimum Experience:0 years Maximum Experience: up to 5 years.****REQUIREMENTS: Laptop/Computer/Smart phone****JOB FEATURES: 1.No hard target you can do minimum 30 pages in 7 days 2.No internet required to do the work 3.You can work from any location 4.Hassle free payment guarantee 5.100% payment guaranteed 6.Its very useful for students, retired person housewife & job seekers 7.You can work from home.  ****************************************************************************************************************************************************** Regards, Gautam, Whatsapp number: 7899580103 Thank You"
78,"Home Based, Data Entry Jobs, Work From Home, Data Entry Jobs, Online Data Entry jobs, Typing Jobs",Company Name Confidential,0-5 years,Not Specified,"WE ARE PROVIDING: Data Entry Jobs,Work From Home Jobs,Part Time Jobs,Online Data Entry Jobs,Typing Jobs,Work At Home Jobs,Based Data Entry,Back Office,Non Voice,Freelance,Simple Typing ****************************************************************************************************************************************************** For more details contact us on our Whatsapp number: 7899580103 ****************************************************************************************************************************************************** NATURE OF JOB: work from home jobs,online data entry Jobs,Home based Data entry and proof reading,Part Time Full Time Jobs ****************************************************************************************************************************************************** JOB LOCALITY: All India-any location-work from home *****Skills: Basic Computer Knowledge and Basic Typing skills*********  ****************************************************************************************************************************************************** JOB RESPONSIBILITY: Your Job Responsibilities is that you have to submit your work on time without mistake Company will give you the content you have to just type according to the company guidelines.****EXPERIENCE: Minimum Experience:0 years Maximum Experience: up to 5 years.****REQUIREMENTS: Laptop/Computer/Smart phone****JOB FEATURES: 1.No hard target you can do minimum 30 pages in 7 days 2.No internet required to do the work 3.You can work from any location 4.Hassle free payment guarantee 5.100% payment guaranteed 6.Its very useful for students, retired person housewife & job seekers 7.You can work from home.  ****************************************************************************************************************************************************** Regards, Gautam, Whatsapp number: 7899580103 Thank You"
79,"Data Entry Jobs, Part Time Jobs, Work From Home Jobs, Online Data Entry Jobs, Home Based Online Jobs",Company Name Confidential,0-5 years,Not Specified,"WE ARE PROVIDING: Data Entry Jobs,Work From Home Jobs,Part Time Jobs,Online Data Entry Jobs,Typing Jobs,Work At Home Jobs,Based Data Entry,Back Office,Non Voice,Freelance,Simple Typing ****************************************************************************************************************************************************** For more details contact us on our Whatsapp number: 7899580103 ****************************************************************************************************************************************************** NATURE OF JOB: work from home jobs,online data entry Jobs,Home based Data entry and proof reading,Part Time Full Time Jobs ****************************************************************************************************************************************************** JOB LOCALITY: All India-any location-work from home *****Skills: Basic Computer Knowledge and Basic Typing skills*********  ****************************************************************************************************************************************************** JOB RESPONSIBILITY: Your Job Responsibilities is that you have to submit your work on time without mistake Company will give you the content you have to just type according to the company guidelines.****EXPERIENCE: Minimum Experience:0 years Maximum Experience: up to 5 years.****REQUIREMENTS: Laptop/Computer/Smart phone****JOB FEATURES: 1.No hard target you can do minimum 30 pages in 7 days 2.No internet required to do the work 3.You can work from any location 4.Hassle free payment guarantee 5.100% payment guaranteed 6.Its very useful for students, retired person housewife & job seekers 7.You can work from home.  ****************************************************************************************************************************************************** Regards, Gautam, Whatsapp number: 7899580103 Thank You"
80,"Simple Typing Jobs, Home Based, Online Jobs, Part Time Jobs, Work From Home Jobs, Data Entry Jobs",Company Name Confidential,0-5 years,Not Specified,"WE ARE PROVIDING: Data Entry Jobs,Work From Home Jobs,Part Time Jobs,Online Data Entry Jobs,Typing Jobs,Work At Home Jobs,Based Data Entry,Back Office,Non Voice,Freelance,Simple Typing ****************************************************************************************************************************************************** For more details contact us on our Whatsapp number: 7899580103 ****************************************************************************************************************************************************** NATURE OF JOB: work from home jobs,online data entry Jobs,Home based Data entry and proof reading,Part Time Full Time Jobs ****************************************************************************************************************************************************** JOB LOCALITY: All India-any location-work from home *****Skills: Basic Computer Knowledge and Basic Typing skills*********  ****************************************************************************************************************************************************** JOB RESPONSIBILITY: Your Job Responsibilities is that you have to submit your work on time without mistake Company will give you the content you have to just type according to the company guidelines.****EXPERIENCE: Minimum Experience:0 years Maximum Experience: up to 5 years.****REQUIREMENTS: Laptop/Computer/Smart phone****JOB FEATURES: 1.No hard target you can do minimum 30 pages in 7 days 2.No internet required to do the work 3.You can work from any location 4.Hassle free payment guarantee 5.100% payment guaranteed 6.Its very useful for students, retired person housewife & job seekers 7.You can work from home.  ****************************************************************************************************************************************************** Regards, Gautam, Whatsapp number: 7899580103 Thank You"
81,We are hiring for Admin//Front office//HR Executive//Ground Staff,Company Name Confidential,0-5 years,220000 - 880000 INR,"Job Description Send me similar jobs Job Description, Ground Staff Job Description:: Airport Ground Staff must have the ability to handle the situation in every condition along with diplomatic Abilities, the flexibility of attitude, great communication, and organizing skills which are the most essential qualities needed for Airport Ground Staff as they spend much of their time in interacting with air passengers. Knowledge of more than one domestic and foreign languages can prove an added asset for an Airport Ground Staff as he has to meet people from different regions knowing different Languages. Airport Ground Staff must possess a calm and friendly personality, ability to handle people and their belonging to pressure conditions. Above all Airport Ground Staff must possess good health, energy, and stamina for working long and irregular hours as they are responsible for every little work of the passenger once they are landed. Age- 18 to 45 Qualification- 12th any stream followed by Diploma,Graduate or PG Diploma course. Cabin Crew Job Description You will need excellent communication skills in order to understand and see to your customers needs, especially in the case of an emergency. Cabin crew need to be dedicated to excellent customer service as their main role is to provide a comfortable and safe experience for their passengers. Cabin crew members need to work together as a team to make sure that all passengers are looked after and comfortable. Numeracy skills are useful for handling money. In the case of an emergency, it is essential that cabin crew have the ability to remain calm. The ability to deal with a range of people in a polite but firm way is important in such a confined working environment. Age- 18 to 45 Air-Ticketing job Duties Ticket agents greet airline customers, help check baggage, and assign seats on the aircraft. This role involves a large amount of customer service as well as lifting larger bags onto the belt behind the counter. These airline representatives are responsible for handling ticket reservations, cancellations, alterations, and informing customers when a flight has been delayed or cancelled .Even under stressful conditions, a ticket agent is expected to maintain a well groomed appearance and a polite manner. The type of uniform is usually dependent on the airline. The ticket agent is also expected to be able to stand up for hours at a time and frequently lift between 50 and 100 pounds of luggage. Job Qualifications A high school diploma is necessary to get a job as a ticket agent, though a two year college degree is generally preferred. Basic computer skills and experience in customer service are usually necessary and some airlines may require experience with a foreign language. Most airlines have a minimum age requirement of 18 to 45 years old. Schedule flexibility is helpful, and overtime and holiday work is typical. Drug tests are usually mandatory prior to employment and a background check by the FAA is also likely. Age- 18 to 45 Best Regards, (HR Team)"
82,We are hiring for Cabin Crew//Ground Staff//Air Hostess Activities//Admin Executive,Company Name Confidential,0-5 years,220000 - 880000 INR,"Job Description Send me similar jobs Job Description, Ground Staff Job Description:: Airport Ground Staff must have the ability to handle the situation in every condition along with diplomatic Abilities, the flexibility of attitude, great communication, and organizing skills which are the most essential qualities needed for Airport Ground Staff as they spend much of their time in interacting with air passengers. Knowledge of more than one domestic and foreign languages can prove an added asset for an Airport Ground Staff as he has to meet people from different regions knowing different Languages. Airport Ground Staff must possess a calm and friendly personality, ability to handle people and their belonging to pressure conditions. Above all Airport Ground Staff must possess good health, energy, and stamina for working long and irregular hours as they are responsible for every little work of the passenger once they are landed. Age- 18 to 45 Qualification- 12th any stream followed by Diploma,Graduate or PG Diploma course. Cabin Crew Job Description You will need excellent communication skills in order to understand and see to your customers needs, especially in the case of an emergency. Cabin crew need to be dedicated to excellent customer service as their main role is to provide a comfortable and safe experience for their passengers. Cabin crew members need to work together as a team to make sure that all passengers are looked after and comfortable. Numeracy skills are useful for handling money. In the case of an emergency, it is essential that cabin crew have the ability to remain calm. The ability to deal with a range of people in a polite but firm way is important in such a confined working environment. Age- 18 to 45 Air-Ticketing job Duties Ticket agents greet airline customers, help check baggage, and assign seats on the aircraft. This role involves a large amount of customer service as well as lifting larger bags onto the belt behind the counter. These airline representatives are responsible for handling ticket reservations, cancellations, alterations, and informing customers when a flight has been delayed or cancelled .Even under stressful conditions, a ticket agent is expected to maintain a well groomed appearance and a polite manner. The type of uniform is usually dependent on the airline. The ticket agent is also expected to be able to stand up for hours at a time and frequently lift between 50 and 100 pounds of luggage. Job Qualifications A high school diploma is necessary to get a job as a ticket agent, though a two year college degree is generally preferred. Basic computer skills and experience in customer service are usually necessary and some airlines may require experience with a foreign language. Most airlines have a minimum age requirement of 18 to 45 years old. Schedule flexibility is helpful, and overtime and holiday work is typical. Drug tests are usually mandatory prior to employment and a background check by the FAA is also likely. Age- 18 to 45 Best Regards, (HR Team)"
83,We are hiring for Admin//Front office//HR Executive//Ground Staff,Company Name Confidential,0-5 years,220000 - 880000 INR,"Ground Staff Job Description:: Airport Ground Staff must have the ability to handle the situation in every condition along with diplomatic Abilities, the flexibility of attitude, great communication, and organizing skills which are the most essential qualities needed for Airport Ground Staff as they spend much of their time in interacting with air passengers. Knowledge of more than one domestic and foreign languages can prove an added asset for an Airport Ground Staff as he has to meet people from different regions knowing different Languages. Airport Ground Staff must possess a calm and friendly personality, ability to handle people and their belonging to pressure conditions. Above all Airport Ground Staff must possess good health, energy, and stamina for working long and irregular hours as they are responsible for every little work of the passenger once they are landed. Age- 18 to 45 Qualification- 12th any stream followed by Diploma,Graduate or PG Diploma course. Cabin Crew Job Description You will need excellent communication skills in order to understand and see to your customers needs, especially in the case of an emergency. Cabin crew need to be dedicated to excellent customer service as their main role is to provide a comfortable and safe experience for their passengers. Cabin crew members need to work together as a team to make sure that all passengers are looked after and comfortable. Numeracy skills are useful for handling money. In the case of an emergency, it is essential that cabin crew have the ability to remain calm. The ability to deal with a range of people in a polite but firm way is important in such a confined working environment. Age- 18 to 45 Air-Ticketing job Duties Ticket agents greet airline customers, help check baggage, and assign seats on the aircraft. This role involves a large amount of customer service as well as lifting larger bags onto the belt behind the counter. These airline representatives are responsible for handling ticket reservations, cancellations, alterations, and informing customers when a flight has been delayed or cancelled .Even under stressful conditions, a ticket agent is expected to maintain a well groomed appearance and a polite manner. The type of uniform is usually dependent on the airline. The ticket agent is also expected to be able to stand up for hours at a time and frequently lift between 50 and 100 pounds of luggage. Job Qualifications A high school diploma is necessary to get a job as a ticket agent, though a two year college degree is generally preferred. Basic computer skills and experience in customer service are usually necessary and some airlines may require experience with a foreign language. Most airlines have a minimum age requirement of 18 to 45 years old. Schedule flexibility is helpful, and overtime and holiday work is typical. Drug tests are usually mandatory prior to employment and a background check by the FAA is also likely. Age- 18 to 45 Best Regards, (HR Team)"
84,Urgent Hiring for Cabin Crew / Air hostess / Flight Attendant/Ground-Staff ( Freshers ),Company Name Confidential,2-12 years,240000 - 880000 INR,"Job Description, Ground Staff Job Description:: Airport Ground Staff must have the ability to handle the situation in every condition along with diplomatic Abilities, the flexibility of attitude, great communication, and organizing skills which are the most essential qualities needed for Airport Ground Staff as they spend much of their time in interacting with air passengers. Knowledge of more than one domestic and foreign languages can prove an added asset for an Airport Ground Staff as he has to meet people from different regions knowing different Languages. Airport Ground Staff must possess a calm and friendly personality, ability to handle people and their belonging to pressure conditions. Above all Airport Ground Staff must possess good health, energy, and stamina for working long and irregular hours as they are responsible for every little work of the passenger once they are landed. Age- 18 to 45 Qualification- 12th any stream followed by Diploma,Graduate or PG Diploma course. Cabin Crew Job Description You will need excellent communication skills in order to understand and see to your customers needs, especially in the case of an emergency. Cabin crew need to be dedicated to excellent customer service as their main role is to provide a comfortable and safe experience for their passengers. Cabin crew members need to work together as a team to make sure that all passengers are looked after and comfortable. Numeracy skills are useful for handling money. In the case of an emergency, it is essential that cabin crew have the ability to remain calm. The ability to deal with a range of people in a polite but firm way is important in such a confined working environment. Age- 18 to 45 Air-Ticketing job Duties Ticket agents greet airline customers, help check baggage, and assign seats on the aircraft. This role involves a large amount of customer service as well as lifting larger bags onto the belt behind the counter. These airline representatives are responsible for handling ticket reservations, cancellations, alterations, and informing customers when a flight has been delayed or cancelled .Even under stressful conditions, a ticket agent is expected to maintain a well groomed appearance and a polite manner. The type of uniform is usually dependent on the airline. The ticket agent is also expected to be able to stand up for hours at a time and frequently lift between 50 and 100 pounds of luggage. Job Qualifications A high school diploma is necessary to get a job as a ticket agent, though a two year college degree is generally preferred. Basic computer skills and experience in customer service are usually necessary and some airlines may require experience with a foreign language. Most airlines have a minimum age requirement of 18 to 45 years old. Schedule flexibility is helpful, and overtime and holiday work is typical. Drug tests are usually mandatory prior to employment and a background check by the FAA is also likely. Age- 18 to 45 Best Regards, (HR Team)"
