SN,Title,Company,Experience,Salary,Description
202,Freshers//Air Ticketing Executive//Back office//Ground Staff//Admin Executive,Company Name Confidential,0-5 years,Not Specified,"Job Description Send me similar jobs Job Description, Ground Staff Job Description:: Airport Ground Staff must have the ability to handle the situation in every condition along with diplomatic Abilities, the flexibility of attitude, great communication, and organizing skills which are the most essential qualities needed for Airport Ground Staff as they spend much of their time in interacting with air passengers. Knowledge of more than one domestic and foreign languages can prove an added asset for an Airport Ground Staff as he has to meet people from different regions knowing different Languages. Airport Ground Staff must possess a calm and friendly personality, ability to handle people and their belonging to pressure conditions. Above all Airport Ground Staff must possess good health, energy, and stamina for working long and irregular hours as they are responsible for every little work of the passenger once they are landed. Age- 18 to 45 Qualification- 12th any stream followed by Diploma,Graduate or PG Diploma course. Cabin Crew Job Description You will need excellent communication skills in order to understand and see to your customers needs, especially in the case of an emergency. Cabin crew need to be dedicated to excellent customer service as their main role is to provide a comfortable and safe experience for their passengers. Cabin crew members need to work together as a team to make sure that all passengers are looked after and comfortable. Numeracy skills are useful for handling money. In the case of an emergency, it is essential that cabin crew have the ability to remain calm. The ability to deal with a range of people in a polite but firm way is important in such a confined working environment. Age- 18 to 45 Air-Ticketing job Duties Ticket agents greet airline customers, help check baggage, and assign seats on the aircraft. This role involves a large amount of customer service as well as lifting larger bags onto the belt behind the counter. These airline representatives are responsible for handling ticket reservations, cancellations, alterations, and informing customers when a flight has been delayed or cancelled .Even under stressful conditions, a ticket agent is expected to maintain a well groomed appearance and a polite manner. The type of uniform is usually dependent on the airline. The ticket agent is also expected to be able to stand up for hours at a time and frequently lift between 50 and 100 pounds of luggage. Job Qualifications A high school diploma is necessary to get a job as a ticket agent, though a two year college degree is generally preferred. Basic computer skills and experience in customer service are usually necessary and some airlines may require experience with a foreign language. Most airlines have a minimum age requirement of 18 to 45 years old. Schedule flexibility is helpful, and overtime and holiday work is typical. Drug tests are usually mandatory prior to employment and a background check by the FAA is also likely. Age- 18 to 45 Best Regards,"
203,Urgent recruitment for Ground Staff//Back Office//Admin//Air cargo//Staff nurse,Company Name Confidential,0-5 years,220000 - 880000 INR,"Job Description Send me similar jobs Job Description, Ground Staff Job Description:: Airport Ground Staff must have the ability to handle the situation in every condition along with diplomatic Abilities, the flexibility of attitude, great communication, and organizing skills which are the most essential qualities needed for Airport Ground Staff as they spend much of their time in interacting with air passengers. Knowledge of more than one domestic and foreign languages can prove an added asset for an Airport Ground Staff as he has to meet people from different regions knowing different Languages. Airport Ground Staff must possess a calm and friendly personality, ability to handle people and their belonging to pressure conditions. Above all Airport Ground Staff must possess good health, energy, and stamina for working long and irregular hours as they are responsible for every little work of the passenger once they are landed. Age- 18 to 45 Qualification- 12th any stream followed by Diploma,Graduate or PG Diploma course. Cabin Crew Job Description You will need excellent communication skills in order to understand and see to your customers needs, especially in the case of an emergency. Cabin crew need to be dedicated to excellent customer service as their main role is to provide a comfortable and safe experience for their passengers. Cabin crew members need to work together as a team to make sure that all passengers are looked after and comfortable. Numeracy skills are useful for handling money. In the case of an emergency, it is essential that cabin crew have the ability to remain calm. The ability to deal with a range of people in a polite but firm way is important in such a confined working environment. Age- 18 to 45 Air-Ticketing job Duties Ticket agents greet airline customers, help check baggage, and assign seats on the aircraft. This role involves a large amount of customer service as well as lifting larger bags onto the belt behind the counter. These airline representatives are responsible for handling ticket reservations, cancellations, alterations, and informing customers when a flight has been delayed or cancelled .Even under stressful conditions, a ticket agent is expected to maintain a well groomed appearance and a polite manner. The type of uniform is usually dependent on the airline. The ticket agent is also expected to be able to stand up for hours at a time and frequently lift between 50 and 100 pounds of luggage. Job Qualifications A high school diploma is necessary to get a job as a ticket agent, though a two year college degree is generally preferred. Basic computer skills and experience in customer service are usually necessary and some airlines may require experience with a foreign language. Most airlines have a minimum age requirement of 18 to 45 years old. Schedule flexibility is helpful, and overtime and holiday work is typical. Drug tests are usually mandatory prior to employment and a background check by the FAA is also likely. Age- 18 to 45 Best Regards, (HR Team)"
204,MIS Executive  MIS Manager  MIS,Anmrs IT Solutions,2-5 years,Not Specified,"Enquiry: 80980 66667//63747 67689	Experience into preparing HR dashboards from big data. 	Proficient in working on MS Office - Advanced Excel 	Must have experience in SQL 	Able to multitask, prioritize, and manage time efficiently 	Excellent interpersonal relationship skills 	Able to analyze data and translate results into better solutions. 	Effective time management and learning agility 	Strong Analytical Abilit1. Good in advance Excel. 2.knowledge in any Visualization tool ( eg. Power bi etc...) 3. SQL Knowledge. True link HR Management Solutions  No.306, Ground Floor GST Road, Chrompet , Chennai -600 044 Near To Vettri theatre: Behind Titan Eye plus Showroom Enquiry: 63747 67689//80980 66667 Mail Id : [Confidential Information] Website : hasmithahrhomes.com"
205,Ground staff//Back office//Freshers//Admin//Front office,Company Name Confidential,0-5 years,240000 - 880000 INR,"Job Description, Ground Staff Job Description:: Airport Ground Staff must have the ability to handle the situation in every condition along with diplomatic Abilities, the flexibility of attitude, great communication, and organizing skills which are the most essential qualities needed for Airport Ground Staff as they spend much of their time in interacting with air passengers. Knowledge of more than one domestic and foreign languages can prove an added asset for an Airport Ground Staff as he has to meet people from different regions knowing different Languages. Airport Ground Staff must possess a calm and friendly personality, ability to handle people and their belonging to pressure conditions. Above all Airport Ground Staff must possess good health, energy, and stamina for working long and irregular hours as they are responsible for every little work of the passenger once they are landed. Age- 18 to 45 Qualification- 12th any stream followed by Diploma,Graduate or PG Diploma course. Cabin Crew Job Description You will need excellent communication skills in order to understand and see to your customers needs, especially in the case of an emergency. Cabin crew need to be dedicated to excellent customer service as their main role is to provide a comfortable and safe experience for their passengers. Cabin crew members need to work together as a team to make sure that all passengers are looked after and comfortable. Numeracy skills are useful for handling money. In the case of an emergency, it is essential that cabin crew have the ability to remain calm. The ability to deal with a range of people in a polite but firm way is important in such a confined working environment. Age- 18 to 45 Air-Ticketing job Duties Ticket agents greet airline customers, help check baggage, and assign seats on the aircraft. This role involves a large amount of customer service as well as lifting larger bags onto the belt behind the counter. These airline representatives are responsible for handling ticket reservations, cancellations, alterations, and informing customers when a flight has been delayed or cancelled .Even under stressful conditions, a ticket agent is expected to maintain a well groomed appearance and a polite manner. The type of uniform is usually dependent on the airline. The ticket agent is also expected to be able to stand up for hours at a time and frequently lift between 50 and 100 pounds of luggage. Job Qualifications A high school diploma is necessary to get a job as a ticket agent, though a two year college degree is generally preferred. Basic computer skills and experience in customer service are usually necessary and some airlines may require experience with a foreign language. Most airlines have a minimum age requirement of 18 to 45 years old. Schedule flexibility is helpful, and overtime and holiday work is typical. Drug tests are usually mandatory prior to employment and a background check by the FAA is also likely. Age- 18 to 45 Best Regards, (HR Team)"
206,Urgent recruitment for Ground Staff//Back Office//Admin//Air cargo//Staff nurse,Company Name Confidential,0-5 years,220000 - 880000 INR,"Job Description Send me similar jobs Job Description, Ground Staff Job Description:: Airport Ground Staff must have the ability to handle the situation in every condition along with diplomatic Abilities, the flexibility of attitude, great communication, and organizing skills which are the most essential qualities needed for Airport Ground Staff as they spend much of their time in interacting with air passengers. Knowledge of more than one domestic and foreign languages can prove an added asset for an Airport Ground Staff as he has to meet people from different regions knowing different Languages. Airport Ground Staff must possess a calm and friendly personality, ability to handle people and their belonging to pressure conditions. Above all Airport Ground Staff must possess good health, energy, and stamina for working long and irregular hours as they are responsible for every little work of the passenger once they are landed. Age- 18 to 45 Qualification- 12th any stream followed by Diploma,Graduate or PG Diploma course. Cabin Crew Job Description You will need excellent communication skills in order to understand and see to your customers needs, especially in the case of an emergency. Cabin crew need to be dedicated to excellent customer service as their main role is to provide a comfortable and safe experience for their passengers. Cabin crew members need to work together as a team to make sure that all passengers are looked after and comfortable. Numeracy skills are useful for handling money. In the case of an emergency, it is essential that cabin crew have the ability to remain calm. The ability to deal with a range of people in a polite but firm way is important in such a confined working environment. Age- 18 to 45 Air-Ticketing job Duties Ticket agents greet airline customers, help check baggage, and assign seats on the aircraft. This role involves a large amount of customer service as well as lifting larger bags onto the belt behind the counter. These airline representatives are responsible for handling ticket reservations, cancellations, alterations, and informing customers when a flight has been delayed or cancelled .Even under stressful conditions, a ticket agent is expected to maintain a well groomed appearance and a polite manner. The type of uniform is usually dependent on the airline. The ticket agent is also expected to be able to stand up for hours at a time and frequently lift between 50 and 100 pounds of luggage. Job Qualifications A high school diploma is necessary to get a job as a ticket agent, though a two year college degree is generally preferred. Basic computer skills and experience in customer service are usually necessary and some airlines may require experience with a foreign language. Most airlines have a minimum age requirement of 18 to 45 years old. Schedule flexibility is helpful, and overtime and holiday work is typical. Drug tests are usually mandatory prior to employment and a background check by the FAA is also likely. Age- 18 to 45 Best Regards, (HR Team)"
207,We are hiring for Admin//Front office//HR Executive//Ground Staff,Company Name Confidential,0-4 years,430000 - 730000 INR,"Job Description,Ground Staff Job Description:: Airport Ground Staff must have the ability to handle the situation in every condition along with diplomatic Abilities, the flexibility of attitude, great communication, and organizing skills which are the most essential qualities needed for Airport Ground Staff as they spend much of their time in interacting with air passengers. Knowledge of more than one domestic and foreign languages can prove an added asset for an Airport Ground Staff as he has to meet people from different regions knowing different Languages. Airport Ground Staff must possess a calm and friendly personality, ability to handle people and their belonging to pressure conditions. Above all Airport Ground Staff must possess good health, energy, and stamina for working long and irregular hours as they are responsible for every little work of the passenger once they are landed. Age- 18 to 45 Qualification- 12th any stream followed by Diploma,Graduate or PG Diploma course. Cabin Crew Job Description You will need excellent communication skills in order to understand and see to your customers needs, especially in the case of an emergency. Cabin crew need to be dedicated to excellent customer service as their main role is to provide a comfortable and safe experience for their passengers. Cabin crew members need to work together as a team to make sure that all passengers are looked after and comfortable. Numeracy skills are useful for handling money. In the case of an emergency, it is essential that cabin crew have the ability to remain calm. The ability to deal with a range of people in a polite but firm way is important in such a confined working environment. Age- 18 to 45 Air-Ticketing job Duties Ticket agents greet airline customers, help check baggage, and assign seats on the aircraft. This role involves a large amount of customer service as well as lifting larger bags onto the belt behind the counter. These airline representatives are responsible for handling ticket reservations, cancellations, alterations, and informing customers when a flight has been delayed or cancelled .Even under stressful conditions, a ticket agent is expected to maintain a well groomed appearance and a polite manner. The type of uniform is usually dependent on the airline. The ticket agent is also expected to be able to stand up for hours at a time and frequently lift between 50 and 100 pounds of luggage. Job Qualifications A high school diploma is necessary to get a job as a ticket agent, though a two year college degree is generally preferred. Basic computer skills and experience in customer service are usually necessary and some airlines may require experience with a foreign language. Most airlines have a minimum age requirement of 18 to 45 years old. Schedule flexibility is helpful, and overtime and holiday work is typical. Drug tests are usually mandatory prior to employment and a background check by the FAA is also likely. Age- 18 to 45 Best Regards, (HR Team)"
208,Motion Graphic Designer,Siemens Technology,Not Specified,Not Specified,"Job Description :Are you looking at developing future leaders Come join us at Siemens. Siemens Global Business Services (GBS) is a Siemens Service Company that provides innovative digital solutions and customer-oriented business services. With more than 20 years of experience, Siemens GBS taps into its understanding of how organizations and businesses work to seamlessly integrate, digitalize and optimize business processes with a portfolio that covers end-to-end business needs. Change the future with us Creating Explanatory Videos, Promotional Videos, Commissioning videos in aftereffects. Advanced knowledge of Adobe After Effects, Premiere Pro, Photoshop, Illustrator. After Effects skills include 2D animation, 3D model manipulation, visual effects. We don't need superheroes, just super minds Conceptualize and execute motion animations using visual design. Knowledge of video industry standard formats and media management practices. Familiarity with E- Learning authoring tools such as Articulate storyline or Adobe Captivate software is an added advantage. English language proficiency (writing, reading and speaking) is mandatory, additional proficiency in other Indian languages would be an added advantage. 2-4 years of experience with Motion Graphics and After Effects Assist in the creation of animation storyboards. Provide accurate time estimates for each part of the process. Assist in selecting appropriate audio, graphic and animation styles for the project. Encoding, converting, editing videos, and adding effects/elements to enhance motion graphics. Degree in design, fine arts or related field is a plus Familiarity with design software and technologies. Must be able to mediate creative problems to arrive at the best solution Manage time effectively, ability to multitask and meet deadlines We've got quite a lot to offer. How about you This role is based in Bangalore. But you'll also get to visit other locations in India and globe, so you'll need to go where this journey takes you. In return, you'll get the chance to work with teams impacting entire cities, countries and the shape of things to come. We're Siemens. A collection of over 396,000 minds building the future, one day at a time in over 200 countries. We're dedicated to equality and we welcome applications that reflect the diversity of the communities we work in. All employment decisions at Siemens are based on qualifications, merit and business need. Bring your curiosity and creativity and help us craft tomorrow. Organization: Global Business Services Company: Siemens Technology and Services Private Limited Experience Level: Experienced Professional Full / Part time: Full-time"
209,Motion Graphic Designer,Siemens Technology,Not Specified,Not Specified,"Job Description :Are you looking at developing future leaders Come join us at Siemens. Siemens Global Business Services (GBS) is a Siemens Service Company that provides innovative digital solutions and customer-oriented business services. With more than 20 years of experience, Siemens GBS taps into its understanding of how organizations and businesses work to seamlessly integrate, digitalize and optimize business processes with a portfolio that covers end-to-end business needs. Change the future with us Creating Explanatory Videos, Promotional Videos, Commissioning videos in aftereffects. Advanced knowledge of Adobe After Effects, Premiere Pro, Photoshop, Illustrator. After Effects skills include 2D animation, 3D model manipulation, visual effects. We don't need superheroes, just super minds Conceptualize and execute motion animations using visual design. Knowledge of video industry standard formats and media management practices. Familiarity with E- Learning authoring tools such as Articulate storyline or Adobe Captivate software is an added advantage. English language proficiency (writing, reading and speaking) is mandatory, additional proficiency in other Indian languages would be an added advantage. 2-4 years of experience with Motion Graphics and After Effects Assist in the creation of animation storyboards. Provide accurate time estimates for each part of the process. Assist in selecting appropriate audio, graphic and animation styles for the project. Encoding, converting, editing videos, and adding effects/elements to enhance motion graphics. Degree in design, fine arts or related field is a plus Familiarity with design software and technologies. Must be able to mediate creative problems to arrive at the best solution Manage time effectively, ability to multitask and meet deadlines We've got quite a lot to offer. How about you This role is based in Bangalore. But you'll also get to visit other locations in India and globe, so you'll need to go where this journey takes you. In return, you'll get the chance to work with teams impacting entire cities, countries and the shape of things to come. We're Siemens. A collection of over 396,000 minds building the future, one day at a time in over 200 countries. We're dedicated to equality and we welcome applications that reflect the diversity of the communities we work in. All employment decisions at Siemens are based on qualifications, merit and business need. Bring your curiosity and creativity and help us craft tomorrow. Organization: Global Business Services Company: Siemens Technology and Services Private Limited Experience Level: Experienced Professional Full / Part time: Full-time"
210,"Air ticketing ,Aircraft Maintenance, Ground Staff ,Cabin crew,Cargo, Aviation in Airport jobs",Company Name Confidential,0-5 years,Not Specified,"Job brief Our company is looking for an aircraft mechanic to ensure aircrafts operate properly and securely, based on regional safety regulations. Your primary responsibilities include maintaining and repairing system components. You'll detect malfunctions and fix them using power and hand tools. You will not be alone in this; you'll work closely with your supervisor and other mechanics to deliver quick and efficient solutions. To succeed in this role, you must have excellent manual dexterity and stamina. Hands-on experience with complex equipment is also a must-have skill for you. If you are analytical, detail-oriented with a keen interest in mechanics and aircrafts, we'd like to hear from you. Responsibilities Perform regular system inspections Maintain systems and equipment Use gauges and diagnostic tests to detect malfunctions Repair or replace broken aircraft parts Perform troubleshooting Keep maintenance and repair logs Use power and hand tools (e.g. cranes, grinders) Understand and apply guidelines from manuals and blueprints Ensure compliance with regional safety regulations Collaborate with other mechanics and electricians Requirements and skills Previous experience as a petroleum engineer or in a similar role Hands-on experience with drilling equipment Great mathematical and IT skills Excellent problem-solving and troubleshooting abilities Available for travel to different locations on a regular basis Professional engineering license is required A degree in engineering is a must; MSc is preferredDear CandidatesWe are looking for energetic ground staff to be responsible for administrative duties and communication with passengers. Your duties will include welcoming passengers, providing information, assisting passengers who are disabled or are traveling with small children, checking in luggage, taking reservations, and selling tickets. You should be able to promptly resolve passenger queries and ensure that all passengers are satisfied. To be successful as ground staff, you should display outstanding interpersonal skills and achieve excellent customer service, which consistently meets the goals and vision of the airline company. Ultimately, outstanding ground staff should be able to multi-task and ensure that every passenger is comfortable, safe and well-informed of flight schedules, aircraft delays, weather concerns and other factors that may affect passengers. Ground Staff Responsibilities: Greeting and welcoming passengers, and responding to questions. Checking in baggage. Making reservations. Selling airline tickets. Stocking aircraft with refreshments. Cleaning aircraft after flights. Assisting disabled passengers and those with small children. Providing information to passengers.Ground Staff Requirements: Diploma in administration or travel, or PG diploma course. Experience in customer care. Excellent interpersonal skills. Well-groomed. Willing to work shifts. Computer literate.Interested Candidates can apply for this jobs no need any amount.Thanks &RegardsHr Team"
